tenant_name,title,content,category,tags
"힐링안과의원","라식 수술 비용 안내","힐링안과의 라식 수술 비용은 양안 기준 150만원부터 시작됩니다. 수술 방법에 따라 차이가 있으며, 라식은 150만원, 라섹은 180만원, 스마일라식은 250만원입니다. 정확한 비용은 정밀 검사 후 결정되며, 3개월 무이자 할부도 가능합니다. 수술 비용에는 1년간 무료 사후관리가 포함되어 있습니다.","가격정보","라식,라섹,스마일라식,비용,할부"
"힐링안과의원","라식 수술 전 준비사항","라식 수술 전에는 렌즈 착용을 중단해야 합니다. 소프트렌즈는 3일 전부터, 하드렌즈는 2주 전부터 착용을 중지해주세요. 수술 당일에는 화장을 하지 마시고, 향수나 헤어스프레이도 사용하지 마세요. 보호자와 함께 내원하시는 것을 권장하며, 수술 후 당일은 운전이 불가능합니다. 편안한 복장으로 오시면 됩니다.","수술준비","라식,준비사항,렌즈,당일,보호자"
"힐링안과의원","라식 수술 후 회복기간","라식 수술 후 일상생활 복귀는 빠른 편입니다. 수술 다음날부터 세안과 샤워가 가능하며, 가벼운 운동은 1주일 후, 수영은 1개월 후부터 가능합니다. 시력은 수술 직후부터 개선되며, 안정화까지는 1~3개월 정도 소요됩니다. 정기 검진은 1일, 1주일, 1개월, 3개월, 6개월, 1년 후에 진행됩니다.","회복정보","라식,회복,일상복귀,운동,검진"
"힐링안과의원","스마일라식 장점","스마일라식은 최신 시력교정술로, 각막 절개 부위가 2~4mm로 매우 작아 회복이 빠릅니다. 일반 라식보다 각막 손상이 적고, 안구건조증 발생률이 낮습니다. 수술 시간은 양안 기준 10~15분으로 짧으며, 통증이 거의 없습니다. 각막이 얇거나 안구건조증이 있는 분들에게 적합합니다.","시술정보","스마일라식,장점,각막,건조증,회복"
"힐링안과의원","백내장 수술 안내","힐링안과의 백내장 수술은 최신 장비를 사용하여 안전하게 진행됩니다. 수술 시간은 약 15~20분이며, 국소마취로 진행되어 통증이 거의 없습니다. 수술 후 1~2주 내에 일상생활이 가능하며, 인공수정체 삽입으로 노안까지 개선할 수 있습니다. 건강보험 적용이 가능하여 본인부담금은 약 10~30만원입니다.","백내장","백내장,수술,인공수정체,노안,건강보험"
